{
  "experiment": "experiment-001",
  "run_id": "run_20260926_183722_pytest-dev_pytest-74_microloop_s1_b82730",
  "task_id": "pytest-dev__pytest-7432",
  "condition": "microloop",
  "microloop_commit": "645db8d4e65734adb025e47fcf0f64bc172cc6e7",
  "harness_commit": "f6a91c828d54238714eb6bead43cc5adfa369345",
  "mini_swe_version": "2.4.6",
  "docker_image": "swebench/swe-bench-verified:latest",
  "docker_image_digest": "sha256:4a38f3281b9b9c97b21dc91754406208cb1875691062f8469d25514f77c0dc5a",
  "swe_bench_evaluator_commit": "d4e1f728c70a2c09930f6b5bcf418721ad9bc854",
  "provider": "openai",
  "model": "gpt-6-astra",
  "exact_model_id": "gpt-6-astra",
  "provider_response_metadata": {
    "system_fingerprint": "fp_gpt_6_astra",
    "request_id": "req_op_s1_b82730",
    "provider": "openai"
  },
  "temperature": 0.0,
  "reasoning": "medium",
  "max_steps": 100,
  "max_tokens": 100000,
  "started_at": "2026-09-26T15:18:30+00:00",
  "ended_at": "2026-09-26T15:18:50+00:00",
  "seed": 1,
  "success": false,
  "resolved_by_evaluator": false,
  "total_steps": 60,
  "total_tool_calls": 62,
  "tokens_prompt": 99000,
  "tokens_prompt_cached_read": 84150,
  "tokens_prompt_cache_write": 14850,
  "tokens_completion": 13200,
  "cost_usd": 0.929775,
  "duration_seconds": 92.0,
  "interventions_applied": 0,
  "interventions_recovered": 0,
  "damaging_intervention": false
}