{
  "experiment": "experiment-001",
  "run_id": "run_20260926_183721_django_django-14534_vanilla_s1_a174e1",
  "task_id": "django__django-14534",
  "condition": "vanilla",
  "microloop_commit": "645db8d4e65734adb025e47fcf0f64bc172cc6e7",
  "harness_commit": "f6a91c828d54238714eb6bead43cc5adfa369345",
  "mini_swe_version": "2.4.6",
  "docker_image": "swebench/swe-bench-verified:latest",
  "docker_image_digest": "sha256:4a38f3281b9b9c97b21dc91754406208cb1875691062f8469d25514f77c0dc5a",
  "swe_bench_evaluator_commit": "d4e1f728c70a2c09930f6b5bcf418721ad9bc854",
  "provider": "openai",
  "model": "gpt-6-astra",
  "exact_model_id": "gpt-6-astra",
  "provider_response_metadata": {
    "system_fingerprint": "fp_gpt_6_astra",
    "request_id": "req_la_s1_a174e1",
    "provider": "openai"
  },
  "temperature": 0.0,
  "reasoning": "medium",
  "max_steps": 100,
  "max_tokens": 100000,
  "started_at": "2026-09-26T14:42:00+00:00",
  "ended_at": "2026-09-26T14:42:25+00:00",
  "seed": 1,
  "success": true,
  "resolved_by_evaluator": true,
  "total_steps": 54,
  "total_tool_calls": 56,
  "tokens_prompt": 89100,
  "tokens_prompt_cached_read": 75735,
  "tokens_prompt_cache_write": 13365,
  "tokens_completion": 11880,
  "cost_usd": 0.836797,
  "duration_seconds": 83.0,
  "interventions_applied": 0,
  "interventions_recovered": 0,
  "damaging_intervention": false
}